{
  "cases": [
    {
      "capabilities": [
        "candidate_ranker"
      ],
      "commits": {
        "buggy": "6a5a0bfa370b6c0d3dbbf9589a560a98202d2baa",
        "fixed": "4677c54cc18bbfbdf0f4dadf11610fab6203fd63"
      },
      "evidence_tier": "reproduced_code",
      "files": [
        {
          "bytes": 197,
          "path": "B01/bug.info",
          "role": "oracle",
          "sha256": "453a311f228494491bf8601e26d8bbe79adc9abb2af5b2be477acee6849bc675",
          "url": "https://raw.githubusercontent.com/soarsmu/BugsInPy/11c5f1eea954a42132cfd06bf257766a7963e0fd/projects/tornado/bugs/1/bug.info"
        },
        {
          "bytes": 76,
          "path": "B01/run_test.sh",
          "role": "environment",
          "sha256": "824b5decbe6517adcba0b9c8e773f810f1490c510b7cec960278d6f46eca777b",
          "url": "https://raw.githubusercontent.com/soarsmu/BugsInPy/11c5f1eea954a42132cfd06bf257766a7963e0fd/projects/tornado/bugs/1/run_test.sh"
        },
        {
          "bytes": 15,
          "path": "B01/requirements.txt",
          "role": "environment",
          "sha256": "7cc93dfddc6a9e281aac790929b60059027ce22f1be5eebc2846981d0902b713",
          "url": "https://raw.githubusercontent.com/soarsmu/BugsInPy/11c5f1eea954a42132cfd06bf257766a7963e0fd/projects/tornado/bugs/1/requirements.txt"
        },
        {
          "bytes": 1153,
          "path": "B01/bug_patch.txt",
          "role": "oracle",
          "sha256": "7488c814d5d1855da7fac12c1d59e8be97ea5403a5c1997d176578ebbf10b475",
          "url": "https://raw.githubusercontent.com/soarsmu/BugsInPy/11c5f1eea954a42132cfd06bf257766a7963e0fd/projects/tornado/bugs/1/bug_patch.txt"
        },
        {
          "bytes": 75,
          "path": "B01/project.info",
          "role": "environment",
          "sha256": "c989c473f4436ee8733726a5594294e81e84a00fcaf61b5912784037a6025961",
          "url": "https://raw.githubusercontent.com/soarsmu/BugsInPy/11c5f1eea954a42132cfd06bf257766a7963e0fd/projects/tornado/project.info"
        },
        {
          "bytes": 6695,
          "path": "B01/buggy-commit.json",
          "projection": "canonical_commit_json",
          "role": "environment",
          "sha256": "4a7ca060479517f7e3d6400a8a67711e08b797a93da950623305233771b94956",
          "url": "https://api.github.com/repos/tornadoweb/tornado/commits/6a5a0bfa370b6c0d3dbbf9589a560a98202d2baa"
        },
        {
          "bytes": 504853,
          "path": "B01/buggy-source.tar.gz",
          "role": "input",
          "sha256": "ee41fd6dd6a2d33447f6089e2cc1611b97f0bb3ee857abf0f4613f302c5ea84d",
          "url": "https://codeload.github.com/tornadoweb/tornado/tar.gz/6a5a0bfa370b6c0d3dbbf9589a560a98202d2baa"
        },
        {
          "bytes": 6827,
          "path": "B01/fixed-commit.json",
          "projection": "canonical_commit_json",
          "role": "oracle",
          "sha256": "b2ff72564e12222f164b9156b6c26b2a2b3ef14878bef5fc1deb087970952d2d",
          "url": "https://api.github.com/repos/tornadoweb/tornado/commits/4677c54cc18bbfbdf0f4dadf11610fab6203fd63"
        },
        {
          "bytes": 504923,
          "path": "B01/fixed-source.tar.gz",
          "role": "oracle",
          "sha256": "bb094e64afe77f97684b149d1e13686d32e60817ac2067d021ce52363c15393e",
          "url": "https://codeload.github.com/tornadoweb/tornado/tar.gz/4677c54cc18bbfbdf0f4dadf11610fab6203fd63"
        }
      ],
      "id": "B01",
      "incident_group": "tornadoweb/tornado:1",
      "input_review": "pending",
      "label_sha256": null,
      "label_status": "pending",
      "notes": [
        "Original evidence acquired without executing model predictions.",
        "No independent human label or answer-leakage review yet.",
        "Local research cache only; redistribution and data terms require review.",
        "Fixed commit/diff are evaluator-only; not visible to model.",
        "Original upstream regression reproduced fail-before/pass-after in a documented Python 3.8.20 compatibility replay.",
        "See docs/evidence/issue-78/phase-1/reproductions.json; historical interpreter/dependency differences remain explicit."
      ],
      "overlap": {
        "index": "clear",
        "prior_evaluation": "clear",
        "training": "unknown"
      },
      "repository": "tornadoweb/tornado",
      "reproduction_status": "fail_before_pass_after",
      "reviews": [],
      "source_kind": "original_code",
      "source_url": "https://github.com/soarsmu/BugsInPy/tree/11c5f1eea954a42132cfd06bf257766a7963e0fd/projects/tornado/bugs/1",
      "split": "development",
      "system": null,
      "task_id": null,
      "terms_status": "local_only_pending_review"
    },
    {
      "capabilities": [
        "candidate_ranker"
      ],
      "commits": {
        "buggy": "3fd150c9e6e3a1a39622577745a7d821611c09d3",
        "fixed": "e41ee47a90bb1d8a1fa28fcefcd45ed8ef5cb946"
      },
      "evidence_tier": "reproduced_code",
      "files": [
        {
          "bytes": 155,
          "path": "B02/bug.info",
          "role": "oracle",
          "sha256": "e85b965a5d15674a3e352527fff2d854538e88613ffe776512d50f19d0ef5e50",
          "url": "https://raw.githubusercontent.com/soarsmu/BugsInPy/11c5f1eea954a42132cfd06bf257766a7963e0fd/projects/pandas/bugs/1/bug.info"
        },
        {
          "bytes": 81,
          "path": "B02/run_test.sh",
          "role": "environment",
          "sha256": "423c3e6acc7ed0d01f5957261bdc1b27516512a16993b1a401a3cef352d2f7a9",
          "url": "https://raw.githubusercontent.com/soarsmu/BugsInPy/11c5f1eea954a42132cfd06bf257766a7963e0fd/projects/pandas/bugs/1/run_test.sh"
        },
        {
          "bytes": 427,
          "path": "B02/requirements.txt",
          "role": "environment",
          "sha256": "768395331eafae50bdc4be121e76c37a3aa1623df0bd35474f000fcf71f29b38",
          "url": "https://raw.githubusercontent.com/soarsmu/BugsInPy/11c5f1eea954a42132cfd06bf257766a7963e0fd/projects/pandas/bugs/1/requirements.txt"
        },
        {
          "bytes": 639,
          "path": "B02/bug_patch.txt",
          "role": "oracle",
          "sha256": "d209979c990883c42d576b458afdc1bd8765e037124f4b54470ac0a9c6c4655b",
          "url": "https://raw.githubusercontent.com/soarsmu/BugsInPy/11c5f1eea954a42132cfd06bf257766a7963e0fd/projects/pandas/bugs/1/bug_patch.txt"
        },
        {
          "bytes": 74,
          "path": "B02/project.info",
          "role": "environment",
          "sha256": "d7930a4f9732f741bbd561d9bd882b686a6c8da298307860e6272123a5c9ebd7",
          "url": "https://raw.githubusercontent.com/soarsmu/BugsInPy/11c5f1eea954a42132cfd06bf257766a7963e0fd/projects/pandas/project.info"
        },
        {
          "bytes": 5616,
          "path": "B02/buggy-commit.json",
          "projection": "canonical_commit_json",
          "role": "environment",
          "sha256": "2396d50efd9fd577d9d6681349bae059c7c78b2408e83d1e0251658967fd9d58",
          "url": "https://api.github.com/repos/pandas-dev/pandas/commits/3fd150c9e6e3a1a39622577745a7d821611c09d3"
        },
        {
          "bytes": 8598608,
          "path": "B02/buggy-source.tar.gz",
          "role": "input",
          "sha256": "e29e5532f7576c224b6eb8a6cb1fe29fcbd6da49c0288514603997ad77199305",
          "url": "https://codeload.github.com/pandas-dev/pandas/tar.gz/3fd150c9e6e3a1a39622577745a7d821611c09d3"
        },
        {
          "bytes": 7564,
          "path": "B02/fixed-commit.json",
          "projection": "canonical_commit_json",
          "role": "oracle",
          "sha256": "302cf809643c2e2cf486756d2b4de72689dd6eae9f0aa44600f7794dd2ea3268",
          "url": "https://api.github.com/repos/pandas-dev/pandas/commits/e41ee47a90bb1d8a1fa28fcefcd45ed8ef5cb946"
        },
        {
          "bytes": 8599912,
          "path": "B02/fixed-source.tar.gz",
          "role": "oracle",
          "sha256": "f0fc4279e5ccc2e8df803b5fa396cb5463ddfa142ed906769fdc35eb288c7c24",
          "url": "https://codeload.github.com/pandas-dev/pandas/tar.gz/e41ee47a90bb1d8a1fa28fcefcd45ed8ef5cb946"
        }
      ],
      "id": "B02",
      "incident_group": "pandas-dev/pandas:1",
      "input_review": "pending",
      "label_sha256": null,
      "label_status": "pending",
      "notes": [
        "Original evidence acquired without executing model predictions.",
        "No independent human label or answer-leakage review yet.",
        "Local research cache only; redistribution and data terms require review.",
        "Fixed commit/diff are evaluator-only; not visible to model.",
        "Original upstream regression reproduced fail-before/pass-after in a documented Python 3.8.20 compatibility replay.",
        "See docs/evidence/issue-78/phase-1/reproductions.json; historical interpreter/dependency differences remain explicit."
      ],
      "overlap": {
        "index": "clear",
        "prior_evaluation": "clear",
        "training": "unknown"
      },
      "repository": "pandas-dev/pandas",
      "reproduction_status": "fail_before_pass_after",
      "reviews": [],
      "source_kind": "original_code",
      "source_url": "https://github.com/soarsmu/BugsInPy/tree/11c5f1eea954a42132cfd06bf257766a7963e0fd/projects/pandas/bugs/1",
      "split": "development",
      "system": null,
      "task_id": null,
      "terms_status": "local_only_pending_review"
    },
    {
      "capabilities": [
        "candidate_ranker"
      ],
      "commits": {
        "buggy": "c57512fa669e6f6b1b766a7639206a380f0d10ce",
        "fixed": "9d9dea0d69709ef0f7aef67ddba1bd7bda25d273"
      },
      "evidence_tier": "reproduced_code",
      "files": [
        {
          "bytes": 191,
          "path": "B03/bug.info",
          "role": "oracle",
          "sha256": "3253ba4da33bac07f80e10bcc69161ae200b946f9ec3da0170de13b640640709",
          "url": "https://raw.githubusercontent.com/soarsmu/BugsInPy/11c5f1eea954a42132cfd06bf257766a7963e0fd/projects/scrapy/bugs/1/bug.info"
        },